{
  "schemaVersion": 1,
  "fetchedAt": "2026-09-03T00:00:00.000Z",
  "id": "synthetic-5x5",
  "source": "synthetic",
  "title": "Synthetic five",
  "author": "crossword-agent",
  "style": "american",
  "width": 5,
  "height": 5,
  "parsedBy": "xd-crossword-tools",
  "cells": [
    [
      {
        "row": 0,
        "col": 0,
        "block": false,
        "number": 1
      },
      {
        "row": 0,
        "col": 1,
        "block": false,
        "number": 2
      },
      {
        "row": 0,
        "col": 2,
        "block": true
      },
      {
        "row": 0,
        "col": 3,
        "block": false,
        "number": 3
      },
      {
        "row": 0,
        "col": 4,
        "block": false,
        "number": 4
      }
    ],
    [
      {
        "row": 1,
        "col": 0,
        "block": false,
        "number": 5
      },
      {
        "row": 1,
        "col": 1,
        "block": false
      },
      {
        "row": 1,
        "col": 2,
        "block": false,
        "number": 6
      },
      {
        "row": 1,
        "col": 3,
        "block": false
      },
      {
        "row": 1,
        "col": 4,
        "block": false
      }
    ],
    [
      {
        "row": 2,
        "col": 0,
        "block": false,
        "number": 7
      },
      {
        "row": 2,
        "col": 1,
        "block": false
      },
      {
        "row": 2,
        "col": 2,
        "block": false
      },
      {
        "row": 2,
        "col": 3,
        "block": false
      },
      {
        "row": 2,
        "col": 4,
        "block": false
      }
    ],
    [
      {
        "row": 3,
        "col": 0,
        "block": false,
        "number": 8
      },
      {
        "row": 3,
        "col": 1,
        "block": false
      },
      {
        "row": 3,
        "col": 2,
        "block": false
      },
      {
        "row": 3,
        "col": 3,
        "block": false
      },
      {
        "row": 3,
        "col": 4,
        "block": false
      }
    ],
    [
      {
        "row": 4,
        "col": 0,
        "block": true
      },
      {
        "row": 4,
        "col": 1,
        "block": false
      },
      {
        "row": 4,
        "col": 2,
        "block": true
      },
      {
        "row": 4,
        "col": 3,
        "block": false,
        "number": 9
      },
      {
        "row": 4,
        "col": 4,
        "block": false
      }
    ]
  ],
  "slots": [
    {
      "id": "1A",
      "number": 1,
      "direction": "across",
      "row": 0,
      "col": 0,
      "length": 2,
      "clue": "Cry of surprise",
      "cells": [
        [
          0,
          0
        ],
        [
          0,
          1
        ]
      ]
    },
    {
      "id": "1D",
      "number": 1,
      "direction": "down",
      "row": 0,
      "col": 0,
      "length": 4,
      "clue": "Spoken rather than written",
      "cells": [
        [
          0,
          0
        ],
        [
          1,
          0
        ],
        [
          2,
          0
        ],
        [
          3,
          0
        ]
      ]
    },
    {
      "id": "2D",
      "number": 2,
      "direction": "down",
      "row": 0,
      "col": 1,
      "length": 5,
      "clue": "Chaos and destruction",
      "cells": [
        [
          0,
          1
        ],
        [
          1,
          1
        ],
        [
          2,
          1
        ],
        [
          3,
          1
        ],
        [
          4,
          1
        ]
      ]
    },
    {
      "id": "3A",
      "number": 3,
      "direction": "across",
      "row": 0,
      "col": 3,
      "length": 2,
      "clue": "Greek letter of a famous ratio",
      "cells": [
        [
          0,
          3
        ],
        [
          0,
          4
        ]
      ]
    },
    {
      "id": "3D",
      "number": 3,
      "direction": "down",
      "row": 0,
      "col": 3,
      "length": 5,
      "clue": "Calm self-assurance",
      "cells": [
        [
          0,
          3
        ],
        [
          1,
          3
        ],
        [
          2,
          3
        ],
        [
          3,
          3
        ],
        [
          4,
          3
        ]
      ]
    },
    {
      "id": "4D",
      "number": 4,
      "direction": "down",
      "row": 0,
      "col": 4,
      "length": 5,
      "clue": "Alphabetical list at the back of a book",
      "cells": [
        [
          0,
          4
        ],
        [
          1,
          4
        ],
        [
          2,
          4
        ],
        [
          3,
          4
        ],
        [
          4,
          4
        ]
      ]
    },
    {
      "id": "5A",
      "number": 5,
      "direction": "across",
      "row": 1,
      "col": 0,
      "length": 5,
      "clue": "Artificial silk made from cellulose",
      "cells": [
        [
          1,
          0
        ],
        [
          1,
          1
        ],
        [
          1,
          2
        ],
        [
          1,
          3
        ],
        [
          1,
          4
        ]
      ]
    },
    {
      "id": "6D",
      "number": 6,
      "direction": "down",
      "row": 1,
      "col": 2,
      "length": 3,
      "clue": "The person being addressed",
      "cells": [
        [
          1,
          2
        ],
        [
          2,
          2
        ],
        [
          3,
          2
        ]
      ]
    },
    {
      "id": "7A",
      "number": 7,
      "direction": "across",
      "row": 2,
      "col": 0,
      "length": 5,
      "clue": "Steer clear of",
      "cells": [
        [
          2,
          0
        ],
        [
          2,
          1
        ],
        [
          2,
          2
        ],
        [
          2,
          3
        ],
        [
          2,
          4
        ]
      ]
    },
    {
      "id": "8A",
      "number": 8,
      "direction": "across",
      "row": 3,
      "col": 0,
      "length": 5,
      "clue": "Small parasitic insect",
      "cells": [
        [
          3,
          0
        ],
        [
          3,
          1
        ],
        [
          3,
          2
        ],
        [
          3,
          3
        ],
        [
          3,
          4
        ]
      ]
    },
    {
      "id": "9A",
      "number": 9,
      "direction": "across",
      "row": 4,
      "col": 3,
      "length": 2,
      "clue": "Former partner",
      "cells": [
        [
          4,
          3
        ],
        [
          4,
          4
        ]
      ]
    }
  ],
  "solution": [
    [
      "O",
      "H",
      "",
      "P",
      "I"
    ],
    [
      "R",
      "A",
      "Y",
      "O",
      "N"
    ],
    [
      "A",
      "V",
      "O",
      "I",
      "D"
    ],
    [
      "L",
      "O",
      "U",
      "S",
      "E"
    ],
    [
      "",
      "C",
      "",
      "E",
      "X"
    ]
  ]
}
